{
	"schema": 1,
	"texture": "cyberblock:textures/entity/npc/maxtac_m.png",
	"model": "classic",
	"faction": "NCPD",
	"archetype": [
		"HeavyRangedT3",
		"HeavyMeleeT3",
		"FastRangedT3",
		"FastMeleeT3",
		"FastShotgunnerT3",
		"FastSniperT3",
		"ShotgunnerT3",
		"NetrunnerT3",
		"TechieT3",
		"GenericRangedT3"
	],
	"priority": 10
}
